{"port": 8080, "env": {"PORT": "8080", "STATIC_DIR": "/app/dist"}, "routes": [{"path": "/", "kind": "page"}, {"path": "/staff/", "kind": "page"}, {"path": "/staff/sw.js", "kind": "asset"}, {"path": "/config.json", "kind": "device_config", "note": "CONFIG_FILE이 있을 때만, 없으면 404"}, {"path": "/healthz", "kind": "health"}, {"path": "/readyz", "kind": "ready"}], "not_served_prefixes": ["/v1/"], "user": "app", "device_config_schema": "DeviceConfig.schema.json"}
